{
  "$schema": "http://json-schema.org/draft-07/schema#",
  "type": "object",
  "properties": {
    "name": {
      "type": "string"
    },
    "description": {
      "type": "string"
    },
    "owner": {
      "type": "object",
      "properties": {
        "name": {
          "type": "string"
        },
        "url": {
          "type": "string"
        }
      }
    },
    "categories": {
        "type": "array",
        "description": "Categories available to addons in this repository. Addons reference them by 'key' in their 'categories' field.",
        "items": {
            "type": "object",
            "properties": {
                "key": {
                    "type": "string",
                    "description": "Unique, case sensitive category identifier.",
                    "pattern": "^[a-z0-9-]+$"
                },
                "name": {
                    "type": "string",
                    "description": "Display name of the category."
                },
                "description": {
                    "type": "string"
                }
            },
            "required": ["key", "name"]
        }
    },
    "repository": {
        "type": "array",
        "description": "Registry entries: an addon's info.json fields, plus what the registry needs to install it.",
        "items": {
            "allOf": [
                { "$ref": "https://raw.githubusercontent.com/haffff/NordvikManager-Addons/refs/heads/main/schemas/addon.json" },
                { "required": ["repositoryUrl", "releaseUrl", "description", "dependencies", "author", "license"] },
                {
                    "properties": {
                        "readme": {
                            "type": "string",
                            "description": "Optional. A markdown file shown in the app's Addons panel and on nordvikmanager.pl/addons: its raw.githubusercontent.com URL, pinned to the release's tag (e.g. .../NordvikManager-Extras/poll-0.1.0/poll/README.md). The daily sync moves the tag with each new release.",
                            "pattern": "^https://raw\\.githubusercontent\\.com/[^/]+/[^/]+/[^/]+/.+\\.md$"
                        }
                    }
                }
            ]
        }
    }
  }
}
