{
    "$schema": "https://raw.githubusercontent.com/haffff/NordvikManager-Addons/refs/heads/main/schemas/repositorySchema.json",
    "name": "NordvikManager - Main Repository",
    "description": "Main repository for NordvikManager",
    "categories": [
        {
            "key": "game-system",
            "name": "Game systems",
            "description": "Rules, sheets and content for a specific tabletop game system"
        },
        {
            "key": "compatibility",
            "name": "Compatibility layers",
            "description": "Bridges that bring content or sheets from other platforms"
        },
        {
            "key": "theme",
            "name": "Themes",
            "description": "Visual themes for a game: stylesheets, textures and fonts"
        },
        {
            "key": "tools",
            "name": "Tools",
            "description": "Table tools: notes and lore from other apps, polls and other helpers"
        }
    ],
    "repository": [
        {
            "name": "5E Edition",
            "key": "dnd5e",
            "dependencies": [],
            "categories": [
                "game-system"
            ],
            "description": "",
            "version": "0.0.7",
            "author": "haffff",
            "repositoryUrl": "https://github.com/haffff/NordvikManager-5E",
            "releaseUrl": "https://github.com/haffff/NordvikManager-5E/releases/download/0.0.7/nm_5e_0.0.7.zip",
            "license": "AGPL-3.0-only"
        },
        {
            "name": "Roll20 Compatibility Layer",
            "key": "roll20compat",
            "dependencies": [],
            "categories": [
                "compatibility",
                "game-system"
            ],
            "description": "Ports community Roll20 character sheets (Blades in the Dark, Fate Core, ...) as NordvikManager addon cards",
            "version": "0.0.7",
            "author": "haffff",
            "repositoryUrl": "https://github.com/haffff/NordvikManagerRoll20Compat",
            "releaseUrl": "https://github.com/haffff/NordvikManagerRoll20Compat/releases/download/0.0.7/nm_r20_0.0.7.zip",
            "license": "MIT"
        },
        {
            "name": "40K Imperium Maledictum Theme",
            "key": "imperiummaledictumtheme",
            "dependencies": [],
            "categories": [
                "theme"
            ],
            "description": "Dark imperial frame and parchment panels to go with the Imperium Maledictum character sheet. Switches itself on when installed (Game Settings > Appearance).",
            "version": "0.0.5",
            "author": "haffff",
            "repositoryUrl": "https://github.com/haffff/NordvikManager-Themes",
            "releaseUrl": "https://github.com/haffff/NordvikManager-Themes/releases/download/imperium-maledictum-0.0.5/imperium-maledictum.zip",
            "license": "AGPL-3.0-only"
        },
        {
            "name": "Trilium",
            "key": "trilium",
            "dependencies": [],
            "categories": [
                "tools"
            ],
            "description": "Search your Trilium notes from the game, pin them to tokens and share lore with players when the story gets there. Needs TriliumNext with an ETAPI token; a Trilium on your computer or network must be allowed in Application Settings > Server > Local network access.",
            "version": "0.1.4",
            "author": "haffff",
            "repositoryUrl": "https://github.com/haffff/NordvikManager-Extras",
            "releaseUrl": "https://github.com/haffff/NordvikManager-Extras/releases/download/trilium-0.1.4/trilium.zip",
            "license": "AGPL-3.0-only"
        },
        {
            "name": "Obsidian",
            "key": "obsidian",
            "dependencies": [],
            "categories": [
                "tools"
            ],
            "description": "Search your Obsidian vault from the game, pin notes to tokens and share lore with players when the story gets there. Needs Obsidian open with the Local REST API plugin (its HTTP server on); the server's admin allows it in Application Settings > Server > Local network access.",
            "version": "0.1.0",
            "author": "haffff",
            "repositoryUrl": "https://github.com/haffff/NordvikManager-Extras",
            "releaseUrl": "https://github.com/haffff/NordvikManager-Extras/releases/download/obsidian-0.1.0/obsidian.zip",
            "license": "AGPL-3.0-only"
        },
        {
            "name": "Poll",
            "key": "poll",
            "dependencies": [],
            "categories": [
                "tools"
            ],
            "description": "Let the table vote: a poll window pops up for everyone, or vote with /vote in chat. Secret ballots, results hidden until the poll closes, multiple choice and changing your vote are switches per poll. The GM decides whether players can start polls too.",
            "version": "0.1.0",
            "author": "haffff",
            "repositoryUrl": "https://github.com/haffff/NordvikManager-Extras",
            "releaseUrl": "https://github.com/haffff/NordvikManager-Extras/releases/download/poll-0.1.0/poll.zip",
            "license": "AGPL-3.0-only"
        }
    ]
}
